,Clean_tweet,label
16824,"are you ? if not, change something",0
8373,"don't forget his other incantation ""i've always been a winner."" say them together and opponents spontaneouslya|",0
11865,so with our i've been in fora|,0
8288,really looking forward to coming along - coming with,0
784,holy city#tissues !,0
27238,prepare cocktail pay,0
11353,i got bitches that can't stand me over a nigga ion even gaf about anymore d(c),0
24761,a low key local calendar in coming days should lend suppo - westpac,0
13802,real girls posting nude pics of themselves hardcore music,0
149,be n freedom from effo in the present merely means that there has been effo stored up in the past. a theodore roosevelta|,0
16728,ugh true,0
23504,d rbi revises rules for resolution of stressed msme loans,0
22336,you are right! saddens me so many people are buying his and hillarys bs.,0
9232,thank you for the,0
28428,full house tonight makes for one very happy chef wells,0
9187,"after years of making it such an issue, suddenly our sexuality isn't impoant?",0
9720,when you want diary queen but remembered it got burnt down. a|,0
15551,attack bull chase: when you leave the lot despite the fact that you're a strong source of,0
18908,"everybody sympathize with this family, but when the little boy fell in the gorilla pit, most wanted the mother condemned.",0
2176,the highlight of my night is gonna be watching love island,0
21408,attack bull chase: when you leave the lot despite the fact that you're a strong source,0
27544,go germany! d,0
13382,they said the other 53 critically injured are bad so they need people to donate blood locally.,0
25878,i hope your day is a happy one!,0
22017,100 amazing health benefits of cucumbers! is !!,0
23429,oh no im sorry,0
9410,when you make twitter for the first time and don't know what your first tweet should be. first tweet,0
7479,dd(c)morning humor! happy mondaydbe happy no matter what!!,0
3233,bride: a woman with a fine prospect of happiness behind her. aambrose bierce,0
31352,3 more days to go!!!!!,0
30790,"although it's been a tough few months personally, everything is falling right into place now. d",0
30991,i am thankful for weekends.,0
18143,bad news my boyfriend is confused,0
7582,bull up: you will dominate your bull and you will direct it whatever you want it to do. when you sta,0
9247,"not acquainted with culture, trying to lure",0
1397,where to go in negros? not too far and expensive and where we can commute bc we don't have a car. d,0
27558,scheduled delivery is now 23 hrs late. no phone call or update in the last 19 hrs. you have my $$ and purchase.,0
16339,i needed money for parking but i only have my card so i looked on my car floor and came up w 3$ in change easy . i needa clean my card(c),0
6950,today is the day! let's sta getting ready! ! dd,0
22148,"dsurround yourself with people who you, you, you anda|",0
27157,it's funny how the weather can change your mood.,0
9292,off for some intensive dancing in thea|,0
7282,"conservative america is under attack and unjust &amp; prejudicial display against is proof. dod,",0
28108,have a great day dad father's day,0
7138,father's day to all the fathers worldwide. you are and for alla|,0
16023,"are we all not tired of these ?when are we actually going to say ""never again"" and actually mean it and work toa|",0
4785,i am friendly.,0
19136,hardcore better off alone turkish girl hot,0
6698,"2016, you're a mean drunk. go home.",0
1974,d top.tags,0
2289,food diet benefits! - !!,0
8168,the final season begins tonight.... on one hand on the other it's the last season,0
14892,i'm so and now that -,0
11573,gonna be home soon but until then this will have to do,0
6075,i am handsome.,0
22337,how? (did it get that bad).. what? (did no-one notice??)..why?... why?.. hate. hate does that,0
18125,screaming (vine by lola the cockatoo),0
14552,they're all amazing! can't wait to see what's going to be a the ti6! da$?,0
18690,can't wait for 's mass shooting aicle to be reposted for the umpteenth time...,0
27471,"""feelin' goood!!""",0
4837,you too!! father's day!! bakman,0
22424,d ur voices sach a megical d$? w8ing for full cover d#mohmohkedhage &amp; 2 tumhocover,0
10364,"i didn't kno being funny was a ""thing"" comedy actress roundtablea$?i, counting my blessingsdd 1/2",0
2979,selfie,0
28913,we're to have in in just under 3 months...,0
9548,"the teens in the book club are so excited to meet and talk about his incredible memoir, slugg!",0
18124,"maybe it's not about the ending, maybe it's about the story.",0
11890,a pound continues to show signs of building volatility - investec,0
9796,"ready for a fun, fun weekend!",0
9940,fab. encouraging planning meeting for w/ +michael &amp; our home team,0
24835,i am delighted to have been able to source this stunning mercedes sl for my most discerning client,0
25695,finally got time to sit down and watch make happy on netflix! it's brilliant! stop everything and watch it now.a|,0
9110,"finally, after all this fucking heaache and bullshit it's all over, and now i can finally see your true colors. a",0
30705,,0
31420,and that i why robin is and in life!,0
4041,"vineyards &amp; love! a$?i,dddd - - -",0
9314,let no one who loves be unhappy alchemist gift,0
26062,how can your own family members hate on you...,0
24389,the way i thot am about to watch yi tonight thinking its wednesday .....,0
12253,whoever said long distance/military relationships don't work.. you never really tried.,0
630,25mm + 16mm = no washout no flooding good take and all set for another days golf,0
4080,and the brother will have to live with that scene/image for the rest of his life.,0
184,wedding number 10! dddddd 3/4 d 3/4,0
16174,google search results favorable to hillary.,0
13730,such a great movie!,0
6191,a ton of unpaid work. dd tsk..,0
5766,"so often we think our country has come so far and then this happens. , so many lives lostd",0
19098,worst mass shooting in u.s. history,0
7337,"don't worry, people will change their facebook profile pic, status and tweet an empathetic hashtag.",0
15843,curry we need you d meditate ka muna. d,0
11672,9 moods to aim for when a a just wonat cut it,0
13562,just returned from holiday in cornwall. have heard some unfounate comments but not those raised by you. respect 2 u iain,0
12822,my new asics showed up! i'm 2 style releases behind because they fit my feet great i maybe hording them to keep my feet,0
14885,"good vibes ad>>i,dd'd?",0
12767,always in a and love's :)) d,0
8671,save $$ no logins x brokers,0
27678,the sussex ghostbusters are here!!,0
3342,loser and another loser...i know her endorsement will put you over the top! lucky you!,0
9511,oh my god! alaska thunder fuck is going to at axis in my home towwn#gaging face,0
5274,this should be the end.,0
24640,"i had a dream we went skiing, but we never made it out of the lodge. then i woke up and realized it's june and skiing is 6 months away.",0
24618,buffalo simulation: buffalo for you to take in the vicinity of their homes to do. in thi,0
18922,"while no pay in any relationship is fully innocent, remember your words create feelings.",0
15741,coming to arrowhead elementary for the 2016-2017 school year!,0
21414,when you get to the point that you know what i'd going to be in your timehop tomorrow but you don't even care!!,0
241,question of the day: excited for motoasa|,0
13948,said that and people expect to be happy and successful.,0
17709,sculpted gel nails rebeccas nails plymouth,0
457,wow some people's children have nothing better to do then insult people on twitter . .,0
24312,"royal ascot day! d,d>>ddd>>dddegd 3/4",0
25808,beautiful people always have smiles jennifer! no wonder u r so !,0
5976,"learning to love my ""imperfections""",0
1928,r these people this stupid? now suppoer says trump is the rappist. not bill. is this real life? turds,0
30741,2nd to group of,0
8549,they gymnasts faces when queenie walked in was priceless.,0
19883,know what mitch. sadly think majlr is over your head. you lash out at 1 of few last american leaders besides sessions.,0
2281,these lovelies are getting married today x,0
18979,hosting in today! can't wait to meet you all,0
18568,my fitbit flex doesn't want to sync to my app anymore and it's been 6 days! help!,0
27597,i love u take with u all the time in urd+-!!! dddd d|d|d|,0
27667,the cheeto thing worked out great for so rick wilson revives it &amp; adds some anti-christian blasphemy,0
10170,i am enthusiastic.,0
16956,just setting up my account. hello twitter!,0
6671,just a,0
15538,horus in a cage,0
26649,husbands love god more than your ...wives love god more than your the secret to a,0
21981,ole folks taking me out shipping for early bihday gifts d,0
25785,making big koves !,0
21339,pussy free pics nude mature,0
20331,its only a matter of time before or create a tool the race isa|,0
6480,mastered to be in front of others but can't able to master in stop being when alone d,0
24819,good luck !,0
5027,this is the year of change - from blue to green,0
8059,listen to m^m tabique - flamboyant-1.mp3 on fiji,0
29462,.@user because everyones life is a constant persuit for happiness but no one have been able to find a way to remaia|,0
28824,its here finally some relief after a hot summer... thanks rain god... everyone...,0
24628,watch angry grandpa react to gift of new house video:,0
21969,we won!!!!!,0
16744,love u just want a burger right about now :(,0
31618,"colors that remind me of palm springs (collection), lily pulitzer, palm beach dd a|",0
26366,gorilla simulator: you need to do to adapt to the environment. the need to tear the city. materi,0
3179,"its friday! ddd happy children are the best! a$?i,d passepaout4u ltd",0
17171,"rip coach amodu shuaibu, ex-super eagles coach, and nff technical director..just days after keshi's death.. we will miss amodu.. .. dC/dC/dC/",0
13684,my daddy leave -,0
14881,the tale of ladies of marriageable age looking for husbands is at an all time high.the economy is not helping us to help them,0
22673,because it's freedom that makes us happy d$?d,0
8454,"this is a great tool! that it is on chromebook, looking forward a little time with you!",0
8368,again irrational rage under control ddd,0
19452,the new check-in/bag drop in terminal 5 at jfk is amazing! thanks travel,0
19533,"i am so friday 5.05pm - chucking it down a1i,",0
1051,find out about making schools places and i,0
11278,d -&gt; // see you tonight for a fun 8k with friends on top of the a| htta|,0
16190,i am founate.,0
13699,loving my new purchases! cannot wait to get training in them!,0
24453,let's open the door to the weekend d!,0
16401,was so about this week's episode. find her thoughts on in here:,0
18444,crossword clue just now (11 letters): events after movie shootings. my mind actually went to guns. answer: wrap paies.,0
6751,happy bihday biiiitch! d bihday bihdaytoyou,0
22400,"lovely day with all the family for father's day. now to snuggle up with my babe for the rest of the evening aodi, fathersday",0
3594,"i helped someone work thru a paicularly tricky coding issue. not known for having great skills in this area, feeling .",0
3675,m2o coconut cup for paul!#family,0
16063,aaa today was my last exam d so right now!,0
27913,just want to wake up in alex's arms,0
28645,hoping the hot girl on the bus will notice you,0
25979,gorilla simulator: you need to do to adapt to the environment. the need to tear the city,0
21683,come on in for our new hour! try our amazing 4 for $4 treats!,0
29955,"went out to some club tonight out here in the bay. safe to say, fuck i miss old town thotsdale. i really do.",0
18101,us star of the voice christina grimmie has been shot dead at a conce,0
5280,tomorrow is my bihday! thank god thrilled!,0
25655,going to bed with a headache only means one thing.. i'm in for an even bigger headache all day tomorrow d,0
25465,workers in the are and they cant even so,0
15220,hoshi day 1/4,0
9369,only 2 more sleeps to go dd,0
4460,6 days till vic winterfest o 3/4 !o 3/4 !,0
28928,on my way to it's my first - ever ao d,0
8254,: father's day leather wallet,0
11078,this me so |,0
15554,[v repo plus] madtownas buffy makes lone appearance at 22nd bihday pay,0
12636,you're a garbage human for celebrating violence.,0
26088,"buy things about ""flag day 2016"": a|",0
26046,retweeted leah darrow (@user a country that desperate to kill their own children.,0
22936,best for !! !! !!,0
31353,1 month left !! ...,0
2165,2 weeks til i get to see their gorgeous girls and meet the new cats,0
14798,she tried to hold it in. even though she's breaking inside dd,0
25350,when according to an episode of hipsters are now synonymous with the place,0
27504,check out thos snip-it from our happiness video . full video out soon d,0
26271,blue hole,0
4160,i love u take with u all the time in urd+-!!! dddd d|d|d|,0
29357,the from a home something was wrong she never met the little until years later,0
3793,more memes,0
9672,so to read about the impact of tech on real life. how it has changed us and what's to come!,0
21836,its friday!!! lets get inked!,0
19563,today notice sounds,0
7544,i am graceful.,0
31379,"good time ai, a|",0
10375,preconference seminars sta in a few minutes. whoas ready to get going?,0
5570,i choose to and you should too.,0
28942,for family!!! wow!!,0
1940,hello ao,0
9504,'no swimming' signs at gator dwelling lake. is like: 'stay off grass' signs at the edge of a python ia|,0
11314,the app storehouse will be shutting down on july 15...,0
15251,best.sound.ever.,0
23695,stayed up to watch orange is the new black,0
14852,"meet our pit master! !aoo 3/4 uo 3/4 ,",0
21103,my god you have some of the stupidest haters. it really shows our education system in america,0
4830,there's a big difference between being and which one are you?a|,0
26222,bridge over trouble water. a|,0
31633,"well well... somebody's very today, i think...",0
6405,oh sneha you are looking in this photo....i can't see u sad even in a photo,0
23772,we went to the park. she had a run in paddled in the river!,0
3033,the greatest the simples thank you for everything a$?,0
18552,it'd be lol funny if it weren't possible.,0
25854,"well shit... d""",0
29659,ing aa|,0
7935,happiness often sneaks in through a door you didn't know you left open. dda,0
27306,6 days until !!,0
11619,old guy off to get some sleep be &amp; be scotland needs you,0
26011,sunny summer days d,0
31300,got to give this back today,0
27924,bull up: you will dominate your bull and you will direct it whatever you want it to do. when yo,0
17680,"please note that we will be closed tomorrow, we wish everyone a for tomorrow.#durban#music",0
21961,last hour to grab our last t-shi:,0
18773,little walk to the pub quiz!,0
4309,it's 'liberals' like these that make the democrats no better than conservatives.,0
19979,i am thankful for cats.,0
10910,nude sexy amature girls fucked hardly monkey sex,0
21250,happy feet.,0
673,dont wait 4 there,0
22924,enjoying my excellent products,0
828,"ours, too. so much terribly news over the weekend!",0
9009,hold the door.....,0
1158,"great view! muscari with daffodils and tulips,",0
3035,when you're excited to go to work so you can get away from homework,0
10716,"ai, my song ai, dP heyyyy wait a minute dP no you can't do this to me d gwen stefani - make me like you",0
18616,anyone who suppos clinton on a feminist basis only cares about white centered feminism and that's disturbing and disgustina|,0
11523,was like one of the best from to the and was a beast but it looks like the ga|,0
24590,happy bihday sirjee bihdayelectroman ji,0
28917,aww yeah it's all good bing bong bing bong,0
4739,"o 3/4 d>>o 3/4 d>>o 3/4 d>> ad>>i,",0
17401,my current mixture of moods:,0
12355,"check us out on the web: join us sunday, june 19, 2016",0
12348,you've delayed the flight even more now! such a disgusting service you provide. no suppo staff to assist in depaures,0
7205,blonde hair ... i don't care. dd 1/4,0
10903,always be,0
17371,appletstag,0
14527,for his next what a,0
5062,i am ecstatic.,0
15956,"listening to 'dolphins' by tim buckley as i sit here painting laurel leaves; and in equal measures d,",0
18297,a cpi is forecast to increase by 0.6% m/m - tds,0
2598,special delivery in the mail today! we're in business y'all!,0
5864,clinton: i'm 'happy to use' the phrase 'radical islamism': presumptive democratic presidential nominee...,0
14691,"i want to watch spy story &amp; have/had all these cool, kick ass spies &amp; don't even capatalize on it.",0
30572,thunderball - thunderdance (1994) hardcore techno download here:,0
19106,iqbal's bihday ddddd be the best ballll,0
25186,friday has me like.... friday styling and photography bentleya|,0
14450,have officially been booked to host a workshop in this years festival! very and !,0
7000,waiting in the dark for my first film of which is,0
1325,d new hope temple,0
8354,"flip, flip, flip.... laugh. love it when people just enjoy what i do.",0
30355,danky the slob everybody (green shi) has the audacity to say my wife looks like a bulldog. look at this kid...,0
19751,gift for proud dads.available for 1 day,0
20927,not so many fathers dont know where their kids are and dont care .,0
6382,just saw the update in kickstaer.,0
22002,2days left until of ! d,0
19734,i finally collected the courage to message someone on - to make a friend since i have 0 right now. and it didn't go so well,0
21608,why i htta|,0
31370,holy shit. how do you even run a national presidential campaign with 70 people?,0
11631,the is trying to make up some financial ground after the first two series.,0
31440,"my dad thinks i'm ""crazy"" lol but he's crazy too ddd father's day a$?i,a$?i,a$?i,",0
12898,2016 and things like this still happen. when will people learn...,0
13610,have my lover stop being angry at me visit us..&gt;&gt;&gt;,0
22938,"gordie howe's visitation, funeral will be open to public - via app",0
27967,"absolutely terrible pic of me. nice one of clara though, and the wharf! place",0
14007,"for you'll rock it a$?i,",0
20634,i'm just so and for thegoodboxph for helping me with my 158lbsa|,0
16433,my instagram basically consists of lots of dog pictures and selfies,0
24571,went to this morning &amp; a staff came by &amp; asked me if i m a blogger. i said yes. he said he saw my tweets &amp; i m everywhere,0
591,great park but a totally disorganised one!!!,0
10561,when i'm i enjoy the music.... when i'm i understand the lyrics,0
16286,foods for your body!! is !!,0
14790,i love u take with u all the time in urd+-!!! dddd d|d|d|,0
9981,"a different type of recipe, but one that is easy to make -",0
28951,"""shit is about to go off like popocatepetl in here. i'm like a tornado of anger, whirling inside!"".",0
21554,"it's your republicans, like paul ryan, kasich, sen. kirk, etc., who are calling the racist.",0
30548,itas amazing how true this is!,0
4151,it's deva day d!,0
14179,carmineryderrr - na:,0
26495,lol at the replies to this.,0
28568,such a tune.,0
25966,i've heard this is somn ppl do differently-they never make the things they want make them forget what they have,0
8850,of classes - need to find a,0
17952,bitfinex leading the bitcoin rally this weekend. bitcoin trading at $608 now!!,0
19771,i looked at these boots on sale at 11 am. it's now 4 pm and size 8 is gone,0
7311,dd appletstag,0
22867,"sunday lunch yardenaagresta 's dd 1/2 dda$?i,d",0
9826,grown men getting offended is hilarious.,0
3092,sad to hear that as you say a gentleman,0
2663,game 6 is over in the 1st quaer!,0
1358,days,0
20069,"a yen: if yen breaks 100, intervention possible",0
11178,"came in today + we are so by it! sounding absolutely phenomenal, especially so for its size!",0
13411,wish we all had it! :/,0
18173,"europe and us think about us, not much different from how we think about afghans.",0
7453,i am funny.,0
29395,this is going to backfire a lot of us will move to,0
11765,for the to :) have a great &gt;&gt; get free?,0
19858,"as vu fan, feel for vandenburg/family that he threw promising future away for night of deplorable behavior. feel even worse for victim!",0
24193,"having love relation is my thing that i've never seen in m y whole life even my parents can't do that. life, still single! ) :",0
16115,"good morning new york!!! beside myself with excitement! in croton on hudson. the most beautiful house, with beautiful people!",0
30217,thank you !!! dddd,0
23675,bull hill climb: you have to reach the target to complete the task to survive. with strong excit,0
14685,the wait is over !! suit releasing on 22nd june dd a$?a$?,0
12758,this makes us !,0
9797,9h the things i get excited about!,0
37,once more only one word tells it all:,0
18408,enjoy every moment of your life dd,0
8696,aww yeah it's all good bing bong bing bong,0
8729,5 days until out due date,0
21311,father's day baby linda williams legacy,0
18677,"a risk-off extends on brexit woes, asx 200 tanks -2%",0
26568,girl and ddd ddd,0
23745,wide awake! too much gaming news to keep up with!. plus i'm pretty ill atm. feel tons better this morning tho!,0
18579,"be in the peacedd>>doa"" htta|",0
13216,i love u take with u all the time in urd+-!!! dddd d|d|d|,0
31186,heading back to greece next year after 12 years! can't wait!!!,0
21225,"a$?i,a$?i,a$?i,happy bihday chanmia$?i,a$?i,a$?i, day happy chanmid",0
1752,herbal sleep remedies that work!! !!,0
12012,snow princessd 1/2 (r)aa>>a,0
11232,what a complete joke! how do these rape covering up clowns know what to fix if there isn't a repo by pepper h.,0
21853,unfounately social media is the way of the life now...... some people just get out of hand!!!!,0
28427,"contact college dean, find out about intern 2 create new site &amp; upload vids. free 4 reference/wk exper.",0
18403,"the same melee elitist scrubs who bash smash wii u,can't even win a melee local after 7 years of playing melee fox in thea|",0
14433,2 the skating rink..... 9th bihday,0
9298,saved the new carol &amp; tony book to bring here. feels more like holiday with you here val!,0
22331,"oh so very beautiful! much love from (well, right now) london! xxx",0
9984,who is this guy...,0
4842,the main character in (juan rico) is supposed to be filipino,0
16524,"positive, find lessons in life, love family &amp; friends, enjoy simple pleasures, faithful,",0
13760,i am thankful for forgiveness.,0
814,good evening my darling instagram babies.,0
18764,lol this is the stuff their dozens of repoers tasked to trump found? good grief.,0
12177,ffs maybe she's not oblivious maybe she just doesn't give a shit,0
16321,enjoyment in every sip,0
24916,i love u take with u all the time in urd+-!!! dddd d|d|d|,0
4005,new year sex photo of couple having sex,0
27204,you can't help the damsel if she loves her misery.,0
29718,carl bean. no more.,0
12645,i have one more year of being a teenager.,0
20707,chelsea and marco are the most ugliest people of the house. proving money doesn't make you look any better,0
3715,a employment growth likely continued through may a rbc cm,0
23680,war sucks,0
14313,my face when i saw the euro schedule and how it affects d(c)d(c)d(c),0
19727,call me crazy- i don't mind but i love to lough and be funny.,0
17020,a offering free flights to pulse nightclub victims' families,0
31844,some of the things i've been on for this week. to see this come together!,0
533,everything you need for to all the out there from,0
4636,it's crazy how once upon a time you looked at somebody with respect &amp; now when u look at them all u see is disappointment &amp; regret.,0
13942,u didnt invite us either d,0
25010,being ignored.... d after so many years i can't see a change...sadly... i tried to trust.. d,0
25120,why do i keep getting scam job offers?,0
27919,"polar bear climb racing: angry polar bear climb racing, the polar bear living in cold place",0
11328,i am cute.#i_am,0
15255,"meet hugo, maru, spidey and dottie my new pland crewad 1/4 i, ^^",0
19167,all of the a very looking forward to a very busy day today for our n,0
28423,"i am so bloody excited for i want to preorder now, please!?!? definitely booking sept 20th off work!",0
19659,corruption is everywhere these days!!! even in the places you least expect it ...,0
19228,"don't worry, be happyd$?it's fridayd",0
10116,"happy friday d,d,d,",0
25806,wow what a beautiful day !! come and have some family fun in the sun.,0
4814,mera sayaa ban ke chale mere papa fathers day love dad thnku for giving me happy beautifull lyf.....,0
20881,track &amp; field day! go girls go!!!,0
19488,refugees and imm'ts move to to cause of the hype of hope and prosperity until they are poorer than poor.,0
11198,"happy weekend my friends a$?i,d>>",0
30218,justin bieber this weekend and gah brooks next weekend,0
2883,"buffalo simulation: buffalo for you to take in the vicinity of their homes to do. in this way, y",0
27908,on a and mission this week!,0
21780,have a and |,0
22809,"can't wait for my holiday da$?i,d",0
16596,"friday,#downbytheseashored' myle beach state park pier",0
20520,"hair flicks a""a"" london,a|",0
8516,big hugs,0
20825,sorry for the selfie spam dd,0
29837,when u take a n push so hard you pass out when u stand up.,0
15284,it's a good day to have a great day!!!ddd . . .,0
28545,i'm so so excited! miss it every year so i'll be up and out super early to watch!,0
25292,for that work! - !,0
11728,bull up: you will dominate your bull and you will direct it whatever you want it to do. when you sta,0
11069,see you in augst dj t vengossie,0
23303,hope most of my deliveries come 2day!! ddddegddd,0
6627,,0
7561,i'm so hungry gift#enjoy eating meal# win win,0
14392,so are can't wait until time.,0
