,Clean_tweet,label
2197,proves that small dicks make small minds,1
22779,aren't protesting because a won-they do so because trump has fuhered &amp;a|,1
21033,typical lying thats slander of a grp! dont kill 4,1
13502,you'd think would b protesting 24/7 but it doesn't fit their,1
20828,"the ""monster law"" made by republican lawmakers that disenfranchised black voters ""with near surgical precision.a|",1
10849,why is ignored,1
18282,you might be a libtard if...,1
29887,michelle obama is on the crack pipe,1
19558,it and expose me. do it.. you mean nothing to me. expose me as the racist you say i am. i am waiting.,1
20380,nick cannon speaks out against the systemic of via,1
28142,"liz treacy, condone ex-councillor mark hackett's for me",1
26319,"""his"" dad ? did you just assume gender ?",1
17036,wtf rant by inveed aussie flag w/muslim cresca|,1
24024,despite a demoralizing 2016: may ur be / / -free and positive,1
6067,"no liberal believes that. we are the pay of inclusivity who believes in equality for all, anywhere. you are a traa|",1
23364,#NAME?,1
16652,snatch that wig off james brown head &amp; get her out !,1
5164,greek girls having ana sex black girl porn,1
26284,"this is one of those moments on hannity responds to , semi-retarded",1
8241,uk 2016: where it fell to pop star to do the job of the,1
21956,what do you think of saying you had good videos with him. they got him.,1
6810,council staff have been instructed by the anc to go slow and make the da look bad. this was exposed a few weeks ago.,1
6996,"congrats, tucker, you came off exactly as you are.",1
18366,one powerful picture. it takes great humanity and kindness to save the life of someone who hates your existencea|,1
8993,excellent! rambling about: the alt right (@user d,1
3621,porn blue tube office woman,1
9221,expes explain the best way to deal with friends &amp; family.,1
27666,"haha wow. is a for using the n-word &amp; the equivalent of it in arabic ""abd"" which means slave:",1
14470,this is really telling.,1
21705,"in the when you &amp; all those rags that only spread propaganda, fear, hatred,a|",1
24917,"star sheree alleges her neighbors are , over pay permit",1
26663,are you &amp; feel like the are a| on you? listen,1
29204,girls in the world jgirl sex,1
15903,'alt-right' site plans a 'fake black person' twitter campaign,1
22430,plz sign,1
28923,word factory: race denial prevents healing! +5,1
13987,the knee-jerk reaction is to assume that ait must have been isis.a a|,1
22346,fake activist !!!%####&amp;$/,1
18635,"jessica want christmas bdsm ai, a(r)",1
10731,what's humiliating is that our great country will have an ignorant tacky lying president,1
4099,multiple types of racism in america,1
30659,the real jeff sessions.,1
10534,the latest the daily! thanks to,1
11281,dear change a few words and tell me how your aicle isn't ? you people are sick.,1
20045,white nationalist leader reveals 5 of his most horrifying hopes for,1
25570,"meet the white nationalist movementas favorite russian philosopher, aleksandr dugin",1
7243,pathetic fallacy? infantile ? just in case anyone wondered whether had a brain we have prooa|,1
25863,everyone ask why they endorse such blatant,1
30134,"""the blacks""? ""the blacks""? ""blacks""? *facepalm* *smh*",1
21913,he's a what did anyone expect?,1
649,"""nigger?"" of a white kid who grew up in the 60's.",1
9685,b4 sm we didnt hear this latent every single day..,1
8796,the latest the all in one news24 daily! thanks to,1
10516,greenspanas monetary policies equated to declining real wages for workers a| a|a|,1
17857,thought factory: left-right polarisation! +12,1
68,d(c)the white establishment can't have blk folx running around loving themselves and promoting our greatness,1
13009,2017 a new beginning!! getting rid of this good riddance pos!!,1
18497,"content: , harm,",1
3296,lessons to be learned why do we...hate? don't shoot d messenger...just press aaaplay aa...,1
23770,you might be a libtard if...,1
24715,coming from and the,1
15632,allies r unstoppable! via,1
17782,prohibition was from the sta,1
25259,in injustice and inflame protests over ash: tya|,1
9500,welcome 2017 touches new heights!,1
14286,now ask yourself if you really want to follow i'm done.,1
13132,1/2 we're told over &amp; over that laws are need to &amp; realia|,1
22285,thought factory: left-right polarisation! ~7,1
28897,let's do this!,1
3288,why is ignored,1
18435,here is some metrics for ya cowboy now stop nonsensa|,1
11641,"woh reading. ""here's how joseph boyden reinforced systemic oppression of first nations"" via|",1
4952,"2016 was the year white liberals realized how unjust, , and sexist america is",1
3663,"fo woh, texas, police chief: officer acted 'rude' but not racist in viral video",1
1760,this our b 2 end problems like &amp; by turning 2 god of,1
793,any minute will condemn the comments of,1
29198,are you &amp; feel like the are stomping a| you? listen,1
7737,you might be a libtard if...,1
4177,vandalised in in condemns act,1
23873,says who?! your iq is so low u have 2stand on a highstool 2raise your iq. we both know is aa|,1
10498,worst customer service in the united states! already repoed 2 the better business bureau!,1
10347,insane crazy racist white woman reaction! paranormal- insane free classifieds ads,1
1079,"the fn is seeking to rid of its anti-semitic, xenophobic image, but majority of its sympathisers still describe thea|",1
3167,.@user what a douchebag. like his dad!,1
29814,all of you need to stop being racist and just let the terrorists kill you. aC/,1
18487,i would hope so. i can't imagine anyone educated who isn't actively or utterly amoral voting for though.,1
21442,(advanced value chain videos at ),1
1504,"just coz their is a few of these vids, dont mean they are not woh wotching, they are there hilarious, a must watca|",1
5492,we should not conflate islamic extremism with terrorism a|,1
10053,classy!,1
15740,the term jihad is a highly-contested concept. a|,1
13473,jeff sessions omits decades of records for his ag confirmation hearing you can't hide,1
25494,"iave had my id checked by the police zero times in 8 months. of course the discrepancy has ""nothing"" to do i'm a wha|",1
9813,and in a not so stunning response plan to nominate member to lead their pay.,1
4140,word factory: race denial prevents healing! ~9,1
6006,why is it forbidden to write '2 blacks' on a restaurant bill but ok to wear a t shi saying 'kill all whites'?,1
13464,"trophy. i have always been one. by ""educate yourself,""",1
27875,"'the by its very dna, is a largely-unrepentant affair that has no business existing'",1
30526,is still rooted in our society's attitude towards black women's hair. read more from candide uyanze:a|,1
11266,this white crowd turned its back on an all-black basketball team at a high school game.,1
77,"hey, white people: you can call people 'white' by",1
12947,book - enduring conviction: fred korematsu &amp; his quest for hta|,1
4204,it's clear y'all had no good reason to hand the keys over to a goon. but yet...,1
26973,why should this person be rehired? shame on,1
19033,"if you are a non-racist white, other minority don't serve in military while in power",1
1542,"i felt that lawrence fishburn was added as the ""magical negro"" hollywood stereotypes are made of!",1
15062,must be said: voters are guilty of normalizing . which is a form of racism. morality is a not a moveable feaa|,1
22474,racial profiling by in cologne. such disgusting...,1
17453,msg of for a business to end .,1
14528,when they call us they are really saying thea|,1
24981,word factory: race denial prevents healing! ~13,1
10572,"dear , djt not allowing 2 use america's freedoms 2 destroy r freedoms is not or",1
29048,"spread the word &amp; join millions for national day of healing jan. 17, 2017",1
23279,this is sooooo or may be just funny,1
24645,"he must think people are really stupid; otherwise, why would he lie so blatantly? should neve be toleratea|",1
31262,openly and total against graceless goodbye to america's first black president:,1
27983,destroyed in one minute,1
11443,stirs anti-jewish hate &amp; on twitter from progressives,1
29768,the major kind of that people arenat talking enough about via,1
22567,"~ before enabled mp's to make statements. great alt-right work,",1
11520,"8 presidents, same policy on israeli settlements but only obama is slammed as a treacherous anti-semite. a|",1
16799,"&amp; have been talking on the phone. what's the , thug think about that... oh, whoa|",1
5950,how is it that a man comes in last in a race but he is declared a winner?,1
916,aren't protesting because a won-they do so because trump has fuhered &amp;a|,1
25664,hot lesbian having sex office woman,1
15386,clintonas ainvisible hand joba championed by conservatives on the right. a| a|a|,1
10519,no! the neighbor has not been arrested. the cop was more interested in the kid littering than the assault of the kia|,1
21367,you might be a libtard if...,1
9416,"a!i, acharles paladino's racist comments spark calls for resignationa",1
22989,video men and womenmalayalam ameture porn video,1
20732,go fuck yo own assholes dumb mafuckas!!! ddd,1
18858,i thought she had 72 assistants.,1
18600,"from racism to resource development, here are the political stories inuit watched in 2016",1
8170,this is a completely justified call out on my comment. again i do apologize,1
27274,is a coward! who suggests that only white people in can be s.,1
14965,"meet the wilmington peacekeepers, they walk in beauty. week of actions",1
9755,the bearas rapacious hunger for oil also sealed its doom. a|,1
8954,the problem isnat that everyone believes this caoonish rendition of the facts a|,1
25086,maybe he heard the (since 1996) &amp; decided he did not want to go to are not,1
20993,how to defeat ugly prejudice.,1
9753,police kill a substantially larger number of whites every year than they do blacks.,1
9967,"in the news: from racism to resource development, here are the political stories inuit watched in 2016a|",1
5977,"please, just stop.",1
27492,(advanced value chain videos at ),1
15466,you might be a libtard if...,1
31739,my video on the whole situation,1
22078,"of course liberals see everywhere, they are looking at the world through racist eyes.",1
4186,excellent idea! dig deep &amp; hang 'em high! a|,1
9495,what does have against via,1
27516,do you hate ? loves attention. on january...,1
11458,because many of us find obama's policies repugnant does not make us you're liberal raca|,1
9073,are you &amp; feel like the are a| on you? listen,1
30606,we need to a these universities from indoctrinating our children turning them to &amp; &amp;,1
26450,enlightenment is wasted on the wilfully blind. a|,1
9562,enlightenment is wasted on the wilfully blind. a|,1
210,take out the america... - i voted against - i voted against - i voted against - i vota|,1
12826,white: good dark: bad itas a twisted version of thatA makes india racist against its own people!,1
31757,stop these chelski fans.,1
11432,apologists be like ... doubletree by hilton londona|,1
30707,lol these pasty cakes telling the to quit b/c of her choice not to suppo your asshat president is pure comedy. weirdos,1
30699,why is ignored,1
5851,"but! i'm also correct whom our enemies are, and whom to ally with; to rid ourselves of , and join together in what we have in common",1
13538,black girl porn teen virgin sex pictures,1
31594,you might be a libtard if...,1
16808,there is nothing to celebrate.,1
29422,buffalo school districts boots trump ally over racist comments. :,1
8259,the anc never prosecute that type of offences against white people. just listen to zuma and malema and you know why.,1
531,you police during the police are under a consent decree! 75% are,1
9211,how dare you accurately poray china? next they'll say he's a lapdog for putin.a|,1
31899,the end of,1
21319,2017 will be a wonderful year if you're a craving an hand,1
1945,sex free sex hotline numbers,1
14496,in from a cop,1
10604,"""most boys can use a drill..."" really? :-)",1
4166,are a| &amp; feel like the are stomping on you? listen,1
12717,... what can i label him as ..that hasn't been said before? ... just for a servant to ha|,1
23,lumpy says i am a . prove it lumpy.,1
12830,in my previous job every person's response to was doing the &amp; that's including &amp; mgta|,1
19457,calls middle school 'build the wall' chant '',1
4698,"good job on reducing a talented performer to her physical ""assets,"" you douchewaffle.",1
2365,check out this post! confession: i'm,1
18281,"salt lake tech workers experience least racism, survey says - deseret news",1
10729,"content: , harma|",1
10736,(vine by 9/11 did bush),1
17315,anyone listened to the words to this seventies classic,1
24794,ku klux klan originally an arm of the southern democratic pay to terrorize freed slaves and republicans who sympathized with them,1
8994,1.48 projection s,1
5699,thought factory: bbc neutrality on right wing fascism &gt;4,1
10348,i feel triggered by your statement. me &amp; my strawberry blonde locks are going to our safe space.,1
16049,1. lmfao. no. non-white people can be and but is a 'system of oppressia|,1
20640,tyler perry says backlash over his tlc show is 'reverse racism',1
23743,you might be a libtard if...,1
28687,crackers? isn't that a little racist? i mean i'm white but think the kkk should burn in ha|,1
26874,rise up today is out! stories of police brutality from,1
20667,vedic astrology predictions 2017 us president donald trump,1
7583,how does it feel to be most hated potus ever?,1
22635,needs to exit the political and journalism world. exit stage left.,1
4259,the bearas rapacious hunger for oil also sealed its doom. a|,1
11161,"nazis continue to target jews, businesses in",1
28936,couldn't have said this any better nor truthfully donny boy. a|,1
31364,america isn't racist. their are a plethora of reasons for someone not to like obama. you're ignorant in many fashioa|,1
8626,"expressions of , (ie are pa of all marginalized groups, who live w/ fear.",1
19385,white girl has sex with black guy best world sex,1
14107,i am disgusted watching defend her career &amp; intelligence to so informing the future gen is laughable? ..,1
5392,typical lying thats slander of a grp! dont kill 4,1
6167,sea shepherd suppoers are racist!,1
31604,dwyane wade if you hate,1
10768,are a| &amp; feel like the are stomping on you? listen,1
21615,if you are going to call me a then have the balls to put your own hashtag onto it.,1
19115,are you &amp; feel like the are a| on you? listen,1
25077,"what a world. if a man took a dive like that, people would say it was fixed. but b/c is a woman this is expected.",1
3119,check this out! i mentioned this org to you back in april. founder is a girl from nyc. happy new yeaa|,1
17040,islam against racism - press tv,1
21301,joe biden: 'i want to thank' trump for unmasking america's,1
13584,"omg, these trump suppoers are deplorable!",1
16173,if i could this 1000x i wud.,1
3019,the principal resigned! the politicians are corrupt. that means the judges are in...,1
8913,.@user are you seriously considering a performance at the inauguration of a,1
12213,"*free sticker - ""stop sexism""*",1
30839,brother &amp; are nothing new... that whole debacle would've went downa|,1
29112,suspected henrico isn't ' - dec 31 9:46 pm et,1
31891,dr. frances cress welsing - racism defined,1
10166,motherhood...unscripted new post: happy new year a seriously.,1
8004,more americans hate him,1
20161,why is ignored,1
1564,&amp; the keeps telling me that but i see &amp; every other,1
31670,why is always,1
15380,"""these are times of grave danger,with dissent recast as treason, unchained and intolerance on the march""&amp;ita|",1
24232,watch this.,1
8401,next attack wont be in japan. guaranteed.,1
26282,"dear media, when someone is born here, they are what you call ""australians"" even when they do shitty things.",1
1602,paul beloy: is still an issue at varying levels in belgian football,1
14715,why does the government allow behaviour?,1
31132,ignorant by cretin to her job at state&amp;federal fundea|,1
20776,why is 4 whores on ring of fire ?,1
31929,did keep and from being words not to use in .,1
11213,you might be a libtard if...,1
4108,i won't waste my time on some sdob that has to plaster color on his profile blm bacon lettuce maters matter on 2 slices of bread,1
2130,this is disgusting,1
19197,"of course, a person would have to be open to educating self about systemic /how they can be .",1
23129,your comments are reflections of ignorance and world,1
8289,"obama joins the jackals d$? ass america will miss obama, when they realize trump will do nothing for them.",1
28829,video men and women in bed without clothes candid videos sexting,1
11469,"what over-rode journalists' integrity was greed and ambition, along with a total absence of courage.",1
5013,and helps it helps and hus everyone everywhere,1
27573,and a . must feel good.,1
23394,: i can't wait nothing good of a (racist) and ( misogynist) than see to the women like animals.,1
12705,extending your hand &amp; uniting merica is unprecedented!,1
30615,are you &amp; feel like the are stomping on you? a|,1
31865,see what is doing in destroying masjids,1
28500,why is ignored,1
12850,jonjo shelvey = the only man ever to racially abuse someone without saying anything!,1
27593,excellent idea! dig deep &amp; hang 'em high! a|,1
14915,i never been thoughj experience &amp; i never looked at caucasians any differently ~ watch this,1
3988,the abt &amp;,1
6808,carl palladino unfit to be on buffalo school board.,1
29602,provoking neighbours again with noise. the that says - he can do what ever he wants. trash. haters,1
28561,please lecture - via,1
29173,another comment on social media!! idiot!!!,1
4139,will the alt-right promote a new kind of racist genetics?,1
1207,the latest the maryland daily! thanks to,1
11577,we need more aicles like this from on positive narratives against .,1
15859,that's why progressives r d most &amp; ppl of all. only self-hating lazy racists would la|,1
14506,"lisa likes cuckold write now! ai, aa",1
20057,did you ever think we call him names because it's true?,1
22236,"relied on protection to keep his ego up as a . used ,",1
23721,keep standing your ground. interview represents &amp; blatant misrepresentation of valid statementa|,1
11115,indianapolis colts black cheerleader hugs boy who used slur. so. much. class,1
22272,you're running out of bitches to you d(c)d(c)d(c) d(c)d(c)d(c),1
30079,vandalised in in condemns act,1
3656,if itz not to malign a black woman abt raising her son instead of arresting the white man who choked him,1
15522,thank you comrade is it erica avenue? i am making a stop at to find out why she doesnt hire indian domestics,1
9344,go fuck yourself richie. we like it and it's not going anywhere! d$?,1
27045,fights against in various municipalities such as in naboomspruit area,1
11172,"your ignorance, and is egregious. don't dare speak 4 'rest of",1
3577,*this* is everything the next 4 years will be. a|,1
20121,comments about the obamas make him a late contender for the most loathsome character of 2016,1
22249,"apparently taragon is not a ""christmassy herb""",1
12744,"and sorry if we are ethnically cleansing you in east jerusalem or bethlehem, but hey. a|",1
8639,university of wisconsin-madison won't cancel racially biased 'problem of whiteness' course,1
12361,thought factory: left-right polarisation! ~6,1
9877,allows &amp; work for your station. acceptable?,1
2155,you might be a libtard if...,1
13604,the 1% want us to fight and pa|,1
10273,"and being a ww, i feel culpable 4 deeply entrenched systemic that exists so i do all i can to dismantle",1
12835,just pre-ordered this. it sounds a really great book,1
9476,in ufc pay: amanda nunes (@user who was &amp; still is the champ whopped ronda rousey but less of a payday - $3 mil to $100k,1
15974,are you .. feel like the are stomping on you? listen,1
14459,you might be a libtard if...,1
14265,"&amp; joseon people in japan, will abuse the for claims of own rights by rough demo.",1
22366,boob marathi nude women,1
26780,islamic extremism kills tens of thousands of people every year.,1
21621,everyone ask why they endorse such blatant,1
30731,"thereas no such thing as an average christian, or muslim, or jew. a| a|",1
17051,you might be a libtard if...,1
2963,how far is swinging to the right? -,1
8857,are you &amp; feel like a| are stomping on you? listen,1
25620,now comes with a as four groups are given,1
27722,"irony: butthucreepers : sexism aicle because they think it's pro-rapist. it's not, you misogynists htta|",1
24027,- special message for ! it's not your land either ..,1
24857,are a| &amp; feel like the are stomping on you? listen,1
17116,today 1000 s!,1
22085,sea shepherd suppoers are racist!,1
25384,because you're a racist?,1
10295,'cept she plays a celtic woman. celtic symbols and accent etc. but because she's bald character ppl assume she's a man.,1
29879,"awe the peoplea originally meant awe the white, landholding males.a a|",1
19495,prolapsed pussy and women,1
11118,easy. you're a and a,1
912,non stop election i blame for hiding for 8 years 2016 pittsburgh california,1
25751,it is truly sad. a who lot of working class men resent being offered help by a woman. evolution still has a lot ofa|,1
21757,"""green book"" ""sundown towns"", guide a reminder of that faced travellers under",1
21699,donkey proud of murdering real palestinian semitic children - thats what i call,1
15116,'tis the season: co-chair makes 'gorilla' remark about -,1
13779,"leave a 'gweh' below a! if in 2017, you will no longer debate about ora|",1
5510,trump campaign official wants michelle obama to be alet loosea to live with african apes,1
746,used and to win the white house presses attack on khan family and g.o.p. leaders,1
13547,why is ignored,1
6639,and is alive and well on the never let them tell you it isn't.,1
14008,"i dare to speak for the rest of canada, b/c no one else dares, b/c of this massive racist bullying anyone gets fora|",1
8416,on and but none against or or,1
23430,why weneed,1
3324,"when the market crashed in march 2000, greenspan cut interest rates even more a|a|",1
25515,but can vomit a monster truckload of shit about the and they don't jail him for ? pigs,1
16825,another in a position of authority has got to go,1
2097,"argentine women protest facebook's sexist censorship rules, eg 2.",1
5005,he should turn in his resignation.,1
24771,abe govt oppress than or,1
28911,why cant we run this out of,1
15885,"victim of adam saleh refers to black people as ""abeed"" (slaves) in one of his sketches.",1
15242,"don't forget, - research shows that sexist men have psychological problems.",1
13569,vandalised in in condemns act,1
20322,i repeat: very concept of ( to only talk about ea|,1
1894,will fail on anti-morality platform.,1
18968,the latest the eu daily! thanks to,1
1783,no hitler comparisons?,1
27212,"sad how people feel they have to treat others like scum just because of their religion, race, sexuality, ect.",1
4594,leader reveals 5 of his most horrifying hopes for america,1
20219,"could it be that is impossible? real acts of racism is easier to stand up to ...unfounately, youa|",1
5128,"i think his the worst in everything, his hatred towards our country was too much",1
13615,you should take action against your filthy plantation location manager. what a disgraceful pos!,1
30641,people around the world are afraid. the world is primed to react. a|,1
815,"jake is right, 2 many ppl lack the will power to take a stand &amp; drown the small minded &amp; oft evil tendencies of past",1
31372,want to stop ? not sure where to begin? let us show you how: cc:a|,1
2118,the acrusadera west vs. aislamic terrorisma is a popular sequel to capitalism vs. communism.,1
13509,porn videos iran fucking girles,1
31765,what has todayAs attitude to women got in common with that of norman bates?,1
24840,"they call you ""when we go up - they go downa|",1
26846,"the latest ""say what?!?!"" thanks to",1
27477,"prostitutes, a brief history of the behaving badly'",1
987,"""no im not attracted to asian ppl bc im not asian"" what if i tell you no im not attracted to u bc im not (inse race here) hoe",1
18746,i almost always trust brazilians,1
1997,riyadh is renowned for some of the deadliest traffic in the world. a|,1
29869,"good afternoon sweety! d send me letter ai,",1
11697,"i agree, but hard to believe he does, given his strident opposition to ordination of women.",1
23752,official paladino makes crude remarks -,1
21550,"jews, christians and muslims all believe that good will prevail. cnn a|",1
1949,just some trump suppoers voicing their thoughts on women's suffrage and germany's immigration policy... a|,1
13286,thought factory: left-right polarisation! &gt;10,1
25653,i will suspend my funding of u.s. gov until resigns,1
26326,empowerment of by is absolutely scary. this could slip to dangerous levels. look 4 legislative attacks on,1
733,"no, he was definitely a mexican.",1
4574,"here's a ?for the day the government and states county's etc. can smoking, ceain words , in schools ...so ?",1
20048,ally wishes mad cow disease death for - cnn,1
6224,this sums up why i voted for not or syndrome but sovereignty and democracy,1
6402,atk porn pics representations of women in men's alcohol ads,1
18267,word factory: race denial prevents healing! +9,1
811,"i guess is talking about progress in the advancement of ,",1
23055,the radicalism of woodrow wilsonas racism,1
2968,why is 4 whores on ring of fire ?,1
24543,techjunkiejh:athe daily showa unpacks against and on a|,1
