,Clean_tweet,label
28111,this simplistic worldview exists today in the 10 second soundbite. . a|,1
10149,sea shepherd suppoers are racist!,1
12306,carl paladino needs to lose his school board seat. what a disgusting,1
2635,is the dictionary word for anti-black,1
30900,culture is like the horizonaalways in view but never in reach. a| a|,1
7113,i can't believe you keep a like as your spokesperson. what a loser company you are.,1
13703,"it's no surprise that chosen is a mere basket of racists. though, is a buta|",1
2839,you might be a libtard if...,1
21283,this guy is a lunatic. an angry....ignorant....and vicious man!,1
19524,vandalised in in condemns act,1
14272,.@user you are a disgusting wohless pig of a human being...assuming you are human. go play in traffic.,1
790,and you keep telling that only aryans are allowed to rape women! you're just a troll!,1
23434,the latest the blicqeraC/ daily! thanks to,1
19004,that's because and is the new !,1
27479,thank you!! the power of,1
28080,impoant message to all.,1
6064,"man, sees me wearing manchester united hoodie: are you a fan? me: yes! man: are you sure? do you even know one player?a|",1
31272,goodbye 2016.... i definitely hope we leave behind,1
25629,you me too ddddd d1,1
11673,you're a . disgusting.,1
25508,i've had these experiences in europe as an american. is alive and unwell.,1
12407,stay the course! never win dinosaurs belongs to us we will not go back!,1
1525,vandalised in in condemns act,1
20063,"after trump, is the media normalizing the | alternet",1
6207,so when is your next klan meeting?! my wife isn't white &amp; i'm proud of her &amp; our love. we are each others gift froma|,1
9400,people spit on the face of,1
15180,"black hair comes in different styles a in slavery, colonialism and in policing.",1
14305,i'm blessedt,1
11693,"is ? please stop this ""offended culture"" madness!",1
29262,explain your actions. netanyahu you can not claim discrimination when u do it yourself to others.,1
26697,nothing humorous about your jibes u trump official paladino under fire over crude obama remarks -,1
29885,you might be a libtard if...,1
30233,from staing a will we let him?,1
17651,racists never ceased to rant in 2016,1
374,"the pic says otherwise for young girls confined in that kitchen. you are void of meaning, beyond cheap publicity",1
2653,if i'd posted your flag logo in 2008 i'd have been called . forced to bake a cake. same for dancers. elitist asses.,1
12110,because i've been paying attention for the past year/8 years. he's a a|,1
1456,why is ignored,1
6379,thought factory: left-right polarisation! +8,1
3882,i have to say i love me some even if is against,1
15157,when you can't stop,1
15924,nothing would be more dangerous than to give the impression we accept,1
12406,new new new new !new order! new tweets. new new kids on the block. new,1
26531,4 all 2 cou. no media coverage. or wp were victims and feared for their lives. maybe probation. who???,1
10804,i'm trying so hard to make your handwritten indirect pretty and you tweet shit like this. shut up,1
26333,you might be a libtard if...,1
10735,this is what trumpas ny campaign chair had to say about the sitting president of the united states and the first laa|,1
18188,is defunding aboion and sending you to the,1
19387,"so what. jewish, kwanza, jehovas witness.",1
10305,adveisments naked fucking whores,1
6713,"book?? wtf, that's reich?",1
4675,it's not just lasses...,1
23344,this is some serious bs jemele!! women can thrive outside the home!! a|,1
16467,"nope, still struggling to see either or in that observation.",1
28616,this should have been enough 2 just say no ...,1
2715,and it leads to more violence,1
9462,you might be a libtard if...,1
30881,is proud to present team!,1
19705,stop lying about 11 years with an anti-semitic hate group,1
16356,"the italian fascist needs a lobotomy in 2017 that""s my wish. perhaps then he""ll realize yes, carl you are a &amp;",1
19072,most recent criminal negligence by authorities in health &amp; detention staff caused death of &amp; .,1
21043,the acrusadera west vs. aislamic terrorisma is a popular sequel to capitalism vs. communism.a|,1
14836,don't forget the women who are misogynists!,1
10600,the temptation to blame everything on a scapegoat is too strong to resist. a|a|,1
27632,is defunding aboion and sending you to the,1
23603,finally gets supremely called out on via,1
25319,you might be a libtard if...,1
1006,"radicalism shouldn't be countered with . terrorists see us as inhumans, but we ""the free"" can't judge by color,a|",1
8277,"bullshit, he was thrown out for being a muslim",1
9959,i fought against both sides of the argument yesterday:,1
27895,a message of for building a business to end,1
19492,you might be a libtard if...,1
28947,"stop legitimizing by using ""alt-right"" &amp; call them what they are: ""..from nazi doctrine, incl ultranationalism ...""",1
13909,why is ignored,1
25150,the cold war was fought over oil. a| a|,1
31580,why are white people expats when the rest of us are immigrants?,1
9519,confessions of former neo-#confederate.,1
5105,says he's ashamed of things he's done but continues to make shameful remarks to women,1
21540,"the feeling's not mutual, you , islamophobia, , d",1
29239,"well,these sewer rats don't take a cent from me,....i don't use to watch ""football"",......but now,i hate it!",1
22918,"so, who do you think told those dictionaries what is?",1
7261,is the most hated women in america today! get your facts straight ! her and her,1
2997,sea shepherd suppoers are racist!,1
27747,"just got done threatening my coworker to give me money and he says ""black male is illegal"" smh",1
8530,directly applicable to trump.,1
16054,comment on reveals once more the disgusting reality of and in circle,1
1742,i wanna be fucked ! my id 13479 meet me here,1
27518,a good man or woman is measured by stable relationships with opposite sex. not cliches or semantics,1
10650,our most popular post this year was brilliant take on,1
23119,because we have been for the that only want our vote!,1
1002,the latest the volatile daily! thanks to,1
31882,come on n wake the eff up usa! this is craziness. does it all stem from n hatred of ? it seems likea|,1
23136,this will absolutely piss you off.,1
18785,here's a collection of our coverage of women-related issues,1
15158,everyone blamed black/brown communities for crack; who's to blame here?,1
3428,was of my late daddy and my teacher. eu easteuropeans are,1
5845,you might be a libtard if...,1
31484,sea shepherd suppoers are racist!,1
22146,obama has been the most destructive president in history &amp; that is his legend.,1
7325,vps got multi-million dollar bonuses while average americans lost their homes.,1
14821,"russian interference, crosschecking/voter suppression &amp; outdated system doesn't reflect usa|",1
8682,both &amp;,1
24192,let 2017 be that where chops down ..knocks down &amp; pride..make a better &amp; enjoyable,1
11340,the waiter was black himself.for fuck sakes!stop looking for fucking under every rock.a|,1
25545,travelled for game sad and disappointed of fans the sad i can't cheer for my own team .,1
30249,"btw, was a . in adores him (without following him).",1
27505,24hrs passed &amp; i'm still too angry about this d(c) to coherently talk about it.,1
13343,a&amp;e to to push the producers,1
3134,you might be a libtard if...,1
22217,"the more familiar we become, the more difficult it is to stereotype. . a| a|",1
16191,congressman hangs this picture nationas capitol. he should volunteer to be hua|,1
25074,"'an unappetizing scam' :-) | women, we need to throw off the shackles of | |a|",1
16876,factophobia ale with people in 2017 whose use following words:,1
16151,is good place to sta learning abt how one person can be a &amp;,1
13276,what if michelle obama had done this?,1
31026,oops! carl paladino didn't mean to publicly post racist comments...,1
10223,will send you to the inauguration~ join today!!,1
20361,:@ 2nites service look back of ur bible 4maps where biblical events took place. jesus &amp; his disciples r ppl of color. d+-,1
5971,this idiot makes my blood boil!,1
20651,you might be a libtard if...,1
3542,how is the word even in your vocabulary? do you know what it means?,1
3880,when the gets women have to encounter.,1
19677,"a it's vital to address porn's influence when discussing , sexual abuse, and demeaning language about women. hta|",1
25598,"you forgot russia since been betrayed by trump and this has never happened b 4, putin will soon slit his throat.",1
14565,d own team up with &amp; show what &amp; combat,1
25442,"awe the peoplea originally meant awe the white, landholding males.a a|a|",1
22577,i thought this kind of comments were not allowed in someone is breaking the rules. a|,1
7062,i can't believe that they don't show blazing saddles on tv any more just because the lead actor is a black man... that's,1
5682,at work: attorneys for white officer who shot remove black judge from presiding over trial. hta|,1
6389,when the waiter asks if he wants to eat the plate aswell...,1
14080,"d""#whitegenocide telling white students they don't deserve to live is the reason won't die!!d""",1
13476,white girl has sex with black guy nude newzeeland porns,1
15305,did keep and from being words not to use in .,1
30264,"that is why is systemic, rather than just humanity being human. it is power and reinforced each minute!",1
16712,the 4th remake of hi-5 doesn't have the token asian chick.,1
19095,i hate you with all of my being.,1
8169,the for,1
13289,does present as a stereotype?,1
30024,"hello there my love! d i will be glad to see you here ai,",1
18637,"terry bradshaw &amp; george karl: at very least insensitive remarks, at most racist. re: melo and mike tomlin. trump emboldened?",1
3169,work out the idea of creating a substantive argument and making a point rather than calling names.a|,1
11320,the white flight of derek black,1
26637,perfect timing for this tweet!,1
17763,along with make me go through hell d!da|,1
22320,the end of,1
8105,"hello there sweetie! d i will be glad to see you here i,d",1
15011,commercial showing inter-racial couple attacked by suppoers,1
12230,what2inlieuof stop w/#hate. look inside you are,1
28240,you might be a libtard if...,1
26560,"today another attack the japanese and chinese, claims to not be racist",1
24930,you might be a libtard if...,1
28530,is this the kind of tweet you want a company rep sending out?,1
12611,you might be a libtard if...,1
28665,"you're not very sma if you think i hate all ""white males."" i hate racism and sexism. that's it. grow a brain, right wingers!",1
17336,sea shepherd suppoers are racist!,1
6820,"emma stone on hollywood : ""they've given my jokes away to male co-stars"" viaa|",1
22958,i won't waste my time on some sob that has to plaster color on his profile blm bacon lettuce maters matter on 2 slices of bread,1
2898,the correct way it should have been written!!! doesn't matter her profession!!! is clearly still a thing!,1
29913,bernanke bailed out wall street by dumping $600 billion into the largest banks.,1
25528,top stories from featuring,1
23974,"hope to see none of you inauguration wait, i won't be watching the anyway",1
28345,must be heabreaking for within to find they're helpless againsta|,1
6648,"i'm not a lady, bc i have a voice, opinion and i'm not scared to speak my mind! wait.. isn't that &amp; againsta|",1
26843,d own team up with &amp; show what &amp; combat,1
18936,is whiter than kevin federline,1
3303,10 hours of walking in as a woman,1
4230,thank you mr. president obama. the light that revealed darkness in we the people of the usa. we are stronger.,1
114,why not mocked obama for being black.,1
2993,"and a(r)i, on d we oppose and all",1
3602,women nude anal anal t girls,1
30009,"oh yes! and this rude, nasty behavior brought out into main stream!",1
5843,"if ur employees r going to say merry christmas to white people, please teach them to say it to the brown people tooa|",1
11142,ally carl paladino said first lady should go live in a cave with a gorilla prick,1
22511,hmmm...sounds familiar. hasn't held a news coa|,1
20348,dad's happy cam... gbp 16.00 get here:,0
8888,a economy to growth just 0.3%; boj likely to ease fuher - wells fargo,0
17373,i am funny.,0
3253,me haces feliz. d davidcusguen a|,0
16816,dining out d' moonlight beach,0
8691,karelfunk opening night,0
4346,"a dad asked his ~4 y/o daughter ""how's the cappuccino?"" as she sipped on a cup of foamy steamed milk d daddy",0
13285,"popped modern love cd in my car stereo and it ate it! won't play or eject. dC/ guess my car just wants to eat you, matt d",0
14486,step into our for a,0
30443,"father's day to hardworking, &amp; caring dads &amp; to all single mothers who play both roles.",0
28106,the more you listen to the news there is no answers just sadness for such a reckless act world,0
1826,draw finished,0
14406,y'all look like a couple!,0
12377,why's taylor mccaw a cow ?? pls help she is trying to shag me,0
4807,zomg game of thrones!,0
918,"have a happy sunday everyone!!!ai,dad",0
13608,"a clings to gains on draghi, around 1.1400",0
535,our next show is monday at the fiddler's elbow in camden. it's looking like it's going to be a huge night! hta|,0
21030,i am growing.,0
3983,"hey, i saw that you're a fitness fan, so i invite u to test my free app, it's called ""my training"" on appstore",0
22202,okay has been announced i cannot wait to see what penguin and ed get up too! ddddSSa,0
27988,this 14 of june... and my failed one year anniversarry with the ex i loved the most...,0
12680,so to see hoping everyone has a fantastic weekend!,0
26528,today's from my,0
14661,bihday's pay + pond = magnificence!,0
20894,"spectators pay, players get paid!",0
5659,that's probably that shizz you used to say to kelvin,0
12657,we read every single of one of your tweets and we can't wait to reveal the first phase lineup of d,0
289,where is the world heading? you could lose your life just for leaving your home.,0
23259,fathersdayquotes buy things aboa|,0
2739,we're to have mercedes with us tomorrow for some - we hope the stays out!,0
23061,"due to the nature of my work, i miss fav have to catchup on twitter ,",0
18476,when you need to go grocery shopping so you have a sad lunch day. desklunch,0
20939,i am wholesome.,0
25685,a core consumer price index (inflation) (mom) down to -0.1% in may from previous 0.4% a|,0
5661,are you or are you really comfoable? comment below dddd,0
18594,"morning spain! dad,",0
14598,college can't come soon enough!!!,0
7718,just because you are a registered democratic doesn't mean you always vote that way. .,0
30245,a expected at 0.76 in 1-monh a danske bank,0
1290,"can't wait to hear how describes incident since she is incapable of using the words ""radical islamic terrorism""",0
9138,"black, married and with kids owner lamar tyler.",0
16542,people need to sta working together to create better things out of love together not create division by hate,0
18684,he has the right to criticize who has the hea to help. ~abraham lincoln,0
31052,tribute tho . a composition made in favour of one of the goats. . i praya|,0
8825,happy thursday!!!!,0
553,owens football tornament,0
27676,i am thankful for inspiration.,0
2105,"father's day, to my dad who even at his weakest, still remains strong",0
3031,it's raining in nothing comes close this city climate.,0
5652,think i finally decided on my next tattood,0
8716,"to both and wing nuts, disagreement = stupid. absolutes from both r scary!",0
4507,nothing feels worse than waking up to a weekday alarm on a weekend.,0
17478,d,0
12260,"the best filter ddd,#love",0
14944,l o o k!,0
11465,daily cat collage impression,0
14669,wait.. there's avatar2? can't wait to watch it! dd,0
9746,these england fans are so stupid they don't deserve to be out there d$?,0
14745,my cat came back after two weeks! she so thin. i can feel her bones through the skin...,0
4844,that camel tho! dad<<d<<,0
8110,mgaenp was 118 episodes and i thought that was too sho. i stand corrected. it's kahani hamari.,0
28019,4 days until where nothing else matter except the music and having a good time!,0
7548,female british lawmaker jo cox brutally murdered by right-wing pro-#brexit nationalist group,0
24260,electronic music from,0
30890,champions,0
9825,can't wait for me and my fathead to be doing this in july!!,0
13881,gym done d3,0
16759,where i belong ... d$?d,0
17941,i love you more d,0
27004,sheeeeshhh lol,0
29611,we can't wait to treat you,0
13061,"go on, give it a go... well woh it!! wildlife",0
10832,over privileged black child who's been brainwashed into believing a misconstrued version of america,0
14318,the 4 ingredients for a truly,0
2516,i am ok.,0
7473,my bat !! love face.,0
29232,great planning meeting for tidwoh district rainbow pay for the queens 90th bihday,0
9015,i'm gonna watch this wednesday,0
1822,you broads have low self esteem and are willing to settle for anything &amp; .,0
14060,"check out this new trending ! , oprah, blessed",0
8862,getting ready for the opening of hb abc in phoenix,0
2673,when game 5 is here and gone. so tired of all the so called expes flapping mouths. that is why we play the game. win or lose,0
28991,personalised ba... gbp 14.00 get here:,0
20052,foods for your body!! is !!,0
23621,small gains dad>>,0
23693,racism is still alive!,0
29394,yass today is my bihday and i managed to get enough money to buy the exo albums and astro's upcoming mini album dso happy,0
6065,extract emails from a website v304,0
16071,today my of . . in the ... :( . . bc sach me bhot hu me.... :( :p,0
27680,"i have to say i think we are watching the end of an era. from where i'm standing only five pairs, only one camo. !",0
17240,queen_uk: two bihdays in a year. a|,0
12417,i can't wait to hear new things with union j and new member love this amazing group!!,0
24975,celebrating national at our training day,0
10526,"vacation booked ai,",0
17954,going to visit my boyfriend at his job next weekend,0
27088,"ready for with weather so unpredictable shos &amp; wellies is a good call. only 13 days to go, !",0
4545,throwback to graduation on friday ddd 3/4,0
26781,3pm class and i'm already here in the classroom. d,0
25811,i am thankful for electricity.,0
9375,last night in | a|,0
25236,today i learnt the hard way that buying 69p plasters from isn't good if you want the plasters for more than 5 minutes...,0
25595,hard to believe this amazing voice contender was alive 15 hrs ago and dead now. we really just don't know when times up,0
29830,"this. new. mattress. even though my back hus a little, i feel like i'm in heaven.",0
23822,"i just don't know what say to england team.. you guys can't beat russia , even with all your star players.. demn!!!!!!! i lost",0
3439,"fathersday to the in the of my life a$?i,a$?i,a$?i,a$?i,a$?i,",0
5447,very d,0
22132,this is scary - where did we go to that we ended up with this kind of fear?,0
20761,japanese snack box worldwide shipping japan mania,0
18337,why do meet and greets with your favorite band have to be so god damn expensive! miss you guys!!,0
25935,see you in september lizzie!,0
31384,another girl there for APSAPSAPS,0
26923,i think i would just skip rio this time around...d!,0
15141,i am thankful for having imagination.,0
23930,aww yeah it's all good bing bong bing bong,0
30274,lucky looks,0
27872,"summer is up !!! ai,dd>>a+-",0
30974,ramadan mubarak to all muslims all over the world...may this blessed month be full of love...dd>>dd>>dd>>,0
23362,chilling with ranger ajim tunasa|,0
18612,real nigga dPdudSS (work remix),0
28612,everyone for nintendo zelda gameplay!?! some say a special guest may show up to help miyamoto!! : ),0
629,"a independent brexit poll shows leave vote ahead, gbp/usd slumps",0
13058,"""wannabe"" by",0
18192,last week with the prep class,0
2967,"be n an apology may be a sign of weakness, but having the courage to go up to someone and say sorry is a strength. a eileena|",0
11823,so all these little pundits running around 5 moves behind he is thea|,0
11886,pointer-events: none; saved my ass tonight :),0
17145,when saying surname keep saying assassin. i so hope that proves correct. welcome to cardiff patrick,0
19003,new music coming! hear a sneak peek now!!!,0
8077,can't wait for at the o2 tomorrow,0
25482,big horn,0
19018,what is a !,0
10398,hey cool i fit both definitions of 'bilious'!,0
29818,unbelievable that and arguably the oldest european cities are not sites,0
4437,"having fun playing ""afternoon"" by",0
8927,only 1 hour left till exciting announcement !!,0
27406,- - - get - get - internations is the ticket! - join free!,0
1749,"101 followers away from 4000, thank you all new followers, something huge happening with all will be revealed very soon.",0
6079,the way your treating is like your music d(r)d(r)d(r),0
26465,retweets,0
27419,"i'll be all#sunmer long. june to august, and then finish up the summer ina|",0
15761,i'm tweetless right now condolences to families. out having fun and that shit happens. unbelievable,0
20432,i mam weekend!,0
1683,when the girl code doesn't even exist anymore :((( girl,0
1531,"last shot of the hotel we stayed at this weekend, back to the grind,",0
8186,4 ua commitment as u retire from chief justice bihday,0
29322,tbh prolly will sta summer homework tonight,0
29903,8 days to go!,0
24308,to &amp; sad news today terrible too sons too many says thoughts to all,0
29292,#NAME?,0
31874,sunday funday!! dd>>ad,0
16251,"definitely both! both provide a ceain kind of that is paralleled on this hmmm, how to combine the two....",0
17497,"all these years, while misplacing our priorities, others are showing us.",0
3592,3rd anniversary bts btsday with bts wea!you bts aY=rap monster aY=hobi aY=min suga aY=chim chim aY=tae tae aY=kookie,0
4554,such sad sad news thinking of the family and friends x,0
30410,"sometimes, all it takes is a smile via",0
7962,nice trip to a field :),0
30687,tiny crown an 2 b by!,0
21303,doesn't the ball have to go forward from s kick off ? lol,0
26474,"as an older gamer, what a sta to and all brought it - the gaming future is bright",0
2160,show day dd>>,0
18896,happy euro 16 every one,0
3956,meetings with the big boss do not come any better than that d,0
7581,future church plant peeps meet to chill &amp; grill in 4 hours. appreciate prayers from all.,0
15476,all this news in the world is so depressing. i'm tried of crying every day.,0
23484,be happy d. .it drives them crazzzy d,0
20487,adam &amp; eve,0
4316,i'm extremely happy d$?,0
29652,"happy hump day! ai,dd",0
2861,just dropped off cuz at airpo. :(,0
15738,i hate that plastic thing around my head,0
17476,40 points bozo,0
13077,i will make you i will only you i am not of your,0
19075,my petty days over.. i just don't have it in me anymore,0
12701,just realized i get to come home again for another week in august,0
8964,i am brilliant.,0
485,our view from the 27th floor! :) girl,0
21867,i'm afraid imma need longer sessions than my normal sessions. loool,0
28365,herbal sleep remedies that work!! !!,0
17883,oh yea i feel so much better i love feeling the breeze after a fresh cutd d.,0
7678,i guess i found out about you :/,0
24246,hey guys just letting you know im am not gay so fuck all you hoes,0
22855,"requested no red onions on my salad but put on extra, so now the entire salad is ruined",0
11950,it's such a crazy thought to think that some girls will betray their best friends over a guy that hasn't had their back through shit ...,0
13093,ariellesloth - na:,0
26030,creating more smiles at the office!,0
2804,"pa of my morning routinea$?i, my face felt great all day!",0
9318,daddy est. 1997 father's day,0
23462,"whatever we do we shud not forget that yvonne mnisi, pretty nkambule &amp; solomon nyirenda, r still stuck buried under eah at",0
3852,it is raining in indore mp.... mansoon,0
17597,i'm so sad for all that had happened in orlando... dddddd a|,0
22821,i am thankful for forgiveness.,0
21095,love the summer weather d,0
28560,size 10 and 12 left only price $50,0
12553,best essential oils for !!,0
22815,nothing to do with religion. thoughts and prayers with families and victims,0
14539,a the consumer price index n.s.a (yoy): 0% (may),0
20530,u don't believe in american values like respecting &amp; protecting ppl different from yourself. u just r sure u r right.,0
18975,many returns of the day! bihdayameeshapatel,0
4304,"once my sister moves her stuff to new her house, i can sta on my room &amp; walk-in closetdd",0
13937,the forecast is looking good for the hcat collaboration cup,0
18096,day at broadbeach and surfers paradise night market and beach,0
10753,time to sta getting ready for sidney sussex may ball tonight!,0
22491,a life is never useless. each soul that came down to eah is here for a reason. o 3/4,0
11849,i am intelligent.,0
21950,when is the store opening in ealing broadway,0
31540,beautiful russell square gardens d1d1d1#lapatripedialondon16 a|,0
13347,"kroos happy to play role of provider for germany: never one to dwell on his own performance, man of th...",0
20166,trying to kick myself in gear after the bad medical news yesterday.... could use something/someone to cheer me up... feeling,0
12867,"find it desperately that a great country like can achieve so much, yet seems unwilling or unable to solve issue of",0
18514,haha! you mean over 800? for the last 2 months with no more? ok i'm sad now,0
25284,night lovely peeps aY= xx,0
31322,this is not a helpful sight first thing sunday morning?! when app says opens 7,0
28837,the beautiful daddy youssoupha kandji and the little,0
